{
  "version": "1.0.1",
  "channel": "stable",
  "limits": {
    "max_skill_chain_depth": 15,
    "max_orchestration_depth": 6,
    "max_iterations": 8
  },
  "protocols": [
    {
      "id": "pixz.protocol.context",
      "name": "Context Protocol",
      "description": "What/where/authority/staleness/preservation; acquisition order workflow\u2192repo\u2192tools\u2192docs\u2192research\u2192user.",
      "path": "docs/architecture.md"
    },
    {
      "id": "pixz.protocol.workflow",
      "name": "Workflow Propagation",
      "description": "Parent to child workflow inheritance and structured handoff.",
      "path": "schemas/workflow.schema.json"
    },
    {
      "id": "pixz.protocol.argumentation",
      "name": "Argumentation",
      "description": "Claim lifecycle: rationale, evidence, alternatives, counterarguments, falsification, confidence, status, revision.",
      "path": "core/epistemic-reasoning/SKILL.md"
    },
    {
      "id": "pixz.protocol.escalation",
      "name": "Escalation Ladder",
      "description": "retry \u2192 inspect \u2192 alternate \u2192 research \u2192 specialist \u2192 challenge \u2192 parent \u2192 user",
      "path": "core/replanning/SKILL.md"
    }
  ],
  "policies": [
    {
      "id": "pixz.policy.scope-control",
      "name": "Scope Control",
      "description": "Distinguish requested / necessary / optional / out-of-scope; no architecture rewrite for one-bug fixes without evidence.",
      "enforces": [
        "all"
      ]
    },
    {
      "id": "pixz.policy.simplicity",
      "name": "Simplicity",
      "description": "Minimum necessary, not minimum possible; avoid unnecessary abstraction/deps/agents/tools.",
      "enforces": [
        "all"
      ]
    },
    {
      "id": "pixz.policy.change-safety",
      "name": "Change Safety",
      "description": "Reversible / partially / irreversible tiers; stronger scrutiny for higher risk.",
      "enforces": [
        "all"
      ]
    },
    {
      "id": "pixz.policy.anti-ai-slop",
      "name": "Anti-AI Slop",
      "description": "Diagnostic criteria, not dogmatic bans, for design/code/research/docs.",
      "enforces": [
        "design",
        "frontend",
        "engineering"
      ]
    }
  ],
  "skills": [
    {
      "id": "pixz.core.orchestrator",
      "name": "Orchestrator",
      "category": "core",
      "version": "1.0.1",
      "status": "stable",
      "description": "Meta-coordination layer that routes work to the right skills, agents and tools.",
      "triggers": [
        "orchestrate",
        "coordinate",
        "delegate",
        "complex task",
        "multi-step"
      ],
      "requires": [],
      "aggregates": [
        "pixz.core.planning",
        "pixz.core.context-engineering",
        "pixz.core.environment-awareness",
        "pixz.core.capability-discovery",
        "pixz.core.workflow-continuity",
        "pixz.core.epistemic-reasoning",
        "pixz.core.verification",
        "pixz.core.quality-gate"
      ],
      "optional": [
        "pixz.core.epistemic-challenger",
        "pixz.quality.anti-ai-slop"
      ],
      "conflicts": [],
      "compatible_runtimes": [
        "claude",
        "openclaw",
        "opencode",
        "hermes",
        "codex",
        "generic"
      ],
      "inputs": [
        "objective",
        "constraints",
        "context"
      ],
      "outputs": [
        "artifact",
        "findings",
        "verification"
      ],
      "tools": [],
      "path": "core/orchestrator"
    },
    {
      "id": "pixz.core.planning",
      "name": "Planning",
      "category": "core",
      "version": "1.0.1",
      "status": "stable",
      "description": "Decomposes objectives into verifiable, sequenced steps with dependencies and exit criteria.",
      "triggers": [
        "plan",
        "roadmap",
        "break down task",
        "milestone"
      ],
      "requires": [
        "pixz.core.context-engineering"
      ],
      "aggregates": [],
      "optional": [
        "pixz.core.environment-awareness"
      ],
      "conflicts": [],
      "compatible_runtimes": [
        "claude",
        "openclaw",
        "opencode",
        "hermes",
        "codex",
        "generic"
      ],
      "inputs": [
        "objective",
        "constraints",
        "context"
      ],
      "outputs": [
        "artifact",
        "findings",
        "verification"
      ],
      "tools": [],
      "path": "core/planning"
    },
    {
      "id": "pixz.core.context-engineering",
      "name": "Context Engineering",
      "category": "core",
      "version": "1.0.1",
      "status": "stable",
      "description": "Systematic acquisition, validation, sufficiency-checking and preservation of task context.",
      "triggers": [
        "context",
        "requirements",
        "what do we know",
        "gather context"
      ],
      "requires": [],
      "aggregates": [],
      "optional": [],
      "conflicts": [],
      "compatible_runtimes": [
        "claude",
        "openclaw",
        "opencode",
        "hermes",
        "codex",
        "generic"
      ],
      "inputs": [
        "objective",
        "constraints",
        "context"
      ],
      "outputs": [
        "artifact",
        "findings",
        "verification"
      ],
      "tools": [],
      "path": "core/context-engineering"
    },
    {
      "id": "pixz.core.environment-awareness",
      "name": "Environment Awareness",
      "category": "core",
      "version": "1.0.1",
      "status": "stable",
      "description": "Inspects actual OS, runtime, framework, package manager, git, filesystem, and tooling before acting.",
      "triggers": [
        "environment",
        "stack detection",
        "runtime",
        "package manager",
        "git state"
      ],
      "requires": [],
      "aggregates": [],
      "optional": [],
      "conflicts": [],
      "compatible_runtimes": [
        "claude",
        "openclaw",
        "opencode",
        "hermes",
        "codex",
        "generic"
      ],
      "inputs": [
        "objective",
        "constraints",
        "context"
      ],
      "outputs": [
        "artifact",
        "findings",
        "verification"
      ],
      "tools": [],
      "path": "core/environment-awareness"
    },
    {
      "id": "pixz.core.capability-discovery",
      "name": "Capability Discovery",
      "category": "core",
      "version": "1.0.1",
      "status": "stable",
      "description": "Discovers relevant skills, agents, tools, MCP servers and libraries before selecting.",
      "triggers": [
        "discover",
        "what can I use",
        "available tools",
        "find skill"
      ],
      "requires": [],
      "aggregates": [],
      "optional": [],
      "conflicts": [],
      "compatible_runtimes": [
        "claude",
        "openclaw",
        "opencode",
        "hermes",
        "codex",
        "generic"
      ],
      "inputs": [
        "objective",
        "constraints",
        "context"
      ],
      "outputs": [
        "artifact",
        "findings",
        "verification"
      ],
      "tools": [],
      "path": "core/capability-discovery"
    },
    {
      "id": "pixz.core.workflow-continuity",
      "name": "Workflow Continuity",
      "category": "core",
      "version": "1.0.1",
      "status": "stable",
      "description": "Maintains, persists and propagates workflow state across parent and child agents.",
      "triggers": [
        "workflow",
        "continue",
        "handoff",
        "persist state",
        "workflow state"
      ],
      "requires": [
        "pixz.core.context-engineering"
      ],
      "aggregates": [],
      "optional": [],
      "conflicts": [],
      "compatible_runtimes": [
        "claude",
        "openclaw",
        "opencode",
        "hermes",
        "codex",
        "generic"
      ],
      "inputs": [
        "objective",
        "constraints",
        "context"
      ],
      "outputs": [
        "artifact",
        "findings",
        "verification"
      ],
      "tools": [],
      "path": "core/workflow-continuity"
    },
    {
      "id": "pixz.core.delegation-handoff",
      "name": "Delegation & Handoff",
      "category": "core",
      "version": "1.0.1",
      "status": "stable",
      "description": "Structured delegation with explicit inputs, constraints, success criteria and structured returns.",
      "triggers": [
        "delegate",
        "handoff",
        "subagent",
        "dispatch task"
      ],
      "requires": [
        "pixz.core.workflow-continuity",
        "pixz.core.context-engineering"
      ],
      "aggregates": [],
      "optional": [],
      "conflicts": [],
      "compatible_runtimes": [
        "claude",
        "openclaw",
        "opencode",
        "hermes",
        "codex",
        "generic"
      ],
      "inputs": [
        "objective",
        "constraints",
        "context"
      ],
      "outputs": [
        "artifact",
        "findings",
        "verification"
      ],
      "tools": [],
      "path": "core/delegation-handoff"
    },
    {
      "id": "pixz.core.epistemic-reasoning",
      "name": "Epistemic Reasoning",
      "category": "core",
      "version": "1.0.1",
      "status": "stable",
      "description": "Disciplined reasoning: separates fact from inference, tracks assumptions, calibrates confidence, avoids confirmation bias.",
      "triggers": [
        "reason",
        "evidence",
        "assumption",
        "confidence",
        "uncertainty"
      ],
      "requires": [
        "pixz.core.context-engineering"
      ],
      "aggregates": [],
      "optional": [],
      "conflicts": [],
      "compatible_runtimes": [
        "claude",
        "openclaw",
        "opencode",
        "hermes",
        "codex",
        "generic"
      ],
      "inputs": [
        "objective",
        "constraints",
        "context"
      ],
      "outputs": [
        "artifact",
        "findings",